<?xml version="1.0" encoding="UTF-8"?>
<Document xmlns="http://univ.fr/sepa" xmlns:xsi="http://www.w3.org/2001/XMLSchema-instance" xsi:schemaLocation="http://univ.fr/sepa sepa.xsd ">
  <DrctDbtTxInf>
    <PmtId>REF OPE BBBB</PmtId>
    <InstdAmt Ccy="EUR">
      <InstdAmt>2150.0</InstdAmt>
    </InstdAmt>
    <DrctDbtTx>
      <MndtId>MndtId</MndtId>
      <DtOfSgntr>2001-01-01</DtOfSgntr>
    </DrctDbtTx>
    <DbtrAgt>
      <BIC>BANKGBULAAA</BIC>
    </DbtrAgt>
    <Dbtr>
      <NM>NM</NM>
    </Dbtr>
    <DbtrAcct>
      <IBAN>>GB29NWBK1331926819</IBAN>
    </DbtrAcct>
  </DrctDbtTxInf>
</Document>
